[
  {
    "axis": "e",
    "caveats": [
      "dn/dT from these coefficients: -7.1e-5 /K at 1550 nm (negative); do not use for absolute dn/dT.",
      "The refractiveindex.info comment calling this material congruent is wrong; the paper labels it SLN."
    ],
    "check_values": [
      {
        "T_C": 24.5,
        "lambda_nm": 1550,
        "n": 2.1258,
        "source": "computed from these coefficients (scripts/build_data.py regression value, 2026-10-25)",
        "tolerance": 6e-05
      }
    ],
    "coefficients": {
      "a1": 5.078,
      "a2": 0.0964,
      "a3": 0.2065,
      "a4": 61.16,
      "a5": 10.55,
      "a6": 0.0159,
      "b1": 4.677e-07,
      "b2": 7.822e-08,
      "b3": -2.653e-08,
      "b4": 0.0001096
    },
    "default": true,
    "errata": [
      {
        "applied": true,
        "citation": "Erratum, Appl. Phys. B 94, 367 (2009)",
        "doi": "10.1007/s00340-008-3316-8",
        "effect": "Replaces Fig. 3 (dispersion plot) only; Table 1 coefficients unchanged.",
        "issued": "2009"
      }
    ],
    "formula": {
      "expression": "n^2 = a1 + b1 f + (a2 + b2 f)/(L^2 - (a3 + b3 f)^2) + (a4 + b4 f)/(L^2 - a5^2) - a6 L^2; f = (T - 24.5)(T + 570.82), T in C, L in um",
      "form": "gayer-2008",
      "latex": "n^2 = a_1 + b_1 f + \\frac{a_2 + b_2 f}{\\lambda^2 - (a_3 + b_3 f)^2} + \\frac{a_4 + b_4 f}{\\lambda^2 - a_5^2} - a_6 \\lambda^2,\\quad f = (T - 24.5)(T + 570.82)"
    },
    "id": "gayer2008-mgo1-sln-e",
    "lambda_unit": "um",
    "name": "Gayer 2008, 1 mol% MgO:stoichiometric LiNbO3, extraordinary",
    "provenance": {
      "locator": "Table 1, p. 345; Table 1 caption: 1% MgO doped stoichiometric LiNbO3",
      "source_id": "gayer2008",
      "status": "P",
      "transcribed": "2026-10-25"
    },
    "public": true,
    "reference_T_C": 24.5,
    "temperature_dependent": true,
    "valid_T_C": [
      20,
      200
    ],
    "valid_lambda_um": [
      0.5,
      4.0
    ],
    "variant": "mgo1-sln"
  },
  {
    "axis": "e",
    "caveats": [
      "dn/dT from these coefficients is anomalous (2.65e-4 /K for MgO5 n_e at 1550 nm vs 3.75e-5 /K from Jundt CLN). Do not use for absolute dn/dT.",
      "Wavelength validity from the refractiveindex.info entries; temperature validity from the paper."
    ],
    "check_values": [
      {
        "T_C": 24.5,
        "lambda_nm": 1550,
        "n": 2.1306,
        "source": "computed from these coefficients",
        "tolerance": 6e-05
      },
      {
        "T_C": 21,
        "lambda_nm": 1550,
        "n": 2.1299,
        "source": "zelmon1997 corrected MgO5 n_e; independent model",
        "tolerance": 0.0015
      }
    ],
    "coefficients": {
      "a1": 5.756,
      "a2": 0.0983,
      "a3": 0.202,
      "a4": 189.32,
      "a5": 12.52,
      "a6": 0.0132,
      "b1": 2.86e-06,
      "b2": 4.7e-08,
      "b3": 6.113e-08,
      "b4": 0.0001516
    },
    "default": false,
    "errata": [
      {
        "applied": true,
        "citation": "Erratum, Appl. Phys. B 94, 367 (2009)",
        "doi": "10.1007/s00340-008-3316-8",
        "effect": "Replaces Fig. 3 (dispersion plot) only; Table 1 coefficients unchanged.",
        "issued": "2009"
      }
    ],
    "formula": {
      "expression": "n^2 = a1 + b1 f + (a2 + b2 f)/(L^2 - (a3 + b3 f)^2) + (a4 + b4 f)/(L^2 - a5^2) - a6 L^2; f = (T - 24.5)(T + 570.82), T in C, L in um",
      "form": "gayer-2008",
      "latex": "n^2 = a_1 + b_1 f + \\frac{a_2 + b_2 f}{\\lambda^2 - (a_3 + b_3 f)^2} + \\frac{a_4 + b_4 f}{\\lambda^2 - a_5^2} - a_6 \\lambda^2,\\quad f = (T - 24.5)(T + 570.82)"
    },
    "id": "gayer2008-mgo5-e",
    "lambda_unit": "um",
    "name": "Gayer 2008, 5 mol% MgO:congruent LiNbO3, extraordinary",
    "provenance": {
      "locator": "Table 1, p. 345; validity p. 348",
      "source_id": "gayer2008",
      "status": "P",
      "transcribed": "2026-10-25"
    },
    "public": true,
    "reference_T_C": 24.5,
    "temperature_dependent": true,
    "valid_T_C": [
      20,
      200
    ],
    "valid_lambda_um": [
      0.5,
      4.0
    ],
    "variant": "mgo5-cln"
  },
  {
    "axis": "o",
    "caveats": [
      "n_o is reliable only to 1620 nm and about 20-100 C (gayer2008 p. 348); refractiveindex.info lists 0.5-1.7 um.",
      "dn/dT from these coefficients: 1.11e-4 /K at 1550 nm; do not use for absolute dn/dT."
    ],
    "check_values": [
      {
        "T_C": 24.5,
        "lambda_nm": 1550,
        "n": 2.2088,
        "source": "computed from these coefficients",
        "tolerance": 6e-05
      },
      {
        "T_C": 21,
        "lambda_nm": 1550,
        "n": 2.2082,
        "source": "zelmon1997 corrected MgO5 n_o; independent model",
        "tolerance": 0.0015
      }
    ],
    "coefficients": {
      "a1": 5.653,
      "a2": 0.1185,
      "a3": 0.2091,
      "a4": 89.61,
      "a5": 10.85,
      "a6": 0.0197,
      "b1": 7.941e-07,
      "b2": 3.134e-08,
      "b3": -4.641e-09,
      "b4": -2.188e-06
    },
    "default": false,
    "errata": [
      {
        "applied": true,
        "citation": "Erratum, Appl. Phys. B 94, 367 (2009)",
        "doi": "10.1007/s00340-008-3316-8",
        "effect": "Replaces Fig. 3 (dispersion plot) only; Table 1 coefficients unchanged.",
        "issued": "2009"
      }
    ],
    "formula": {
      "expression": "n^2 = a1 + b1 f + (a2 + b2 f)/(L^2 - (a3 + b3 f)^2) + (a4 + b4 f)/(L^2 - a5^2) - a6 L^2; f = (T - 24.5)(T + 570.82), T in C, L in um",
      "form": "gayer-2008",
      "latex": "n^2 = a_1 + b_1 f + \\frac{a_2 + b_2 f}{\\lambda^2 - (a_3 + b_3 f)^2} + \\frac{a_4 + b_4 f}{\\lambda^2 - a_5^2} - a_6 \\lambda^2,\\quad f = (T - 24.5)(T + 570.82)"
    },
    "id": "gayer2008-mgo5-o",
    "lambda_unit": "um",
    "name": "Gayer 2008, 5 mol% MgO:congruent LiNbO3, ordinary",
    "provenance": {
      "locator": "Table 1, p. 345; validity p. 348",
      "source_id": "gayer2008",
      "status": "P",
      "transcribed": "2026-10-25"
    },
    "public": true,
    "reference_T_C": 24.5,
    "temperature_dependent": true,
    "valid_T_C": [
      20,
      100
    ],
    "valid_lambda_um": [
      0.5,
      1.62
    ],
    "variant": "mgo5-cln"
  },
  {
    "axis": "e",
    "check_values": [
      {
        "T_C": 21,
        "lambda_nm": 632.8,
        "n": 2.2022,
        "source": "computed from these coefficients",
        "tolerance": 6e-05
      },
      {
        "T_C": 21,
        "lambda_nm": 1064,
        "n": 2.1555,
        "source": "computed",
        "tolerance": 6e-05
      },
      {
        "T_C": 21,
        "lambda_nm": 1550,
        "n": 2.1376,
        "source": "computed",
        "tolerance": 6e-05
      },
      {
        "T_C": 24.5,
        "lambda_nm": 632.8,
        "n": 2.2028,
        "source": "Nelson & Mikulyak 1974 via weis1985 Table 2; Zelmon is 6e-4 lower",
        "tolerance": 0.0008
      },
      {
        "T_C": 24.5,
        "lambda_nm": 1060,
        "n": 2.1561,
        "source": "Nelson & Mikulyak 1974 via weis1985 Table 2",
        "tolerance": 0.0008
      }
    ],
    "coefficient_units": {
      "B1": "1",
      "B2": "1",
      "B3": "1",
      "C1": "um2",
      "C2": "um2",
      "C3": "um2"
    },
    "coefficients": {
      "B1": 2.9804,
      "B2": 0.5981,
      "B3": 8.9543,
      "C1": 0.02047,
      "C2": 0.0666,
      "C3": 416.08
    },
    "default": true,
    "errata": [],
    "formula": {
      "expression": "n^2 - 1 = B1 L^2/(L^2 - C1) + B2 L^2/(L^2 - C2) + B3 L^2/(L^2 - C3), L in um",
      "form": "sellmeier-3term",
      "latex": "n^2 - 1 = \\sum_{i=1}^{3} \\frac{B_i \\lambda^2}{\\lambda^2 - C_i}",
      "rii_formula": 2
    },
    "id": "zelmon1997-cln-e",
    "lambda_unit": "um",
    "name": "Zelmon 1997, congruent LiNbO3, extraordinary",
    "provenance": {
      "locator": "Table 2 (via refractiveindex.info LiNbO3 Zelmon-e)",
      "source_id": "zelmon1997",
      "status": "P-db",
      "transcribed": "2026-10-25",
      "via": "rii"
    },
    "public": true,
    "reference_T_C": 21,
    "temperature_dependent": false,
    "valid_T_C": null,
    "valid_lambda_um": [
      0.4,
      5.0
    ],
    "variant": "cln"
  },
  {
    "axis": "o",
    "check_values": [
      {
        "T_C": 21,
        "lambda_nm": 632.8,
        "n": 2.2865,
        "source": "computed from these coefficients",
        "tolerance": 6e-05
      },
      {
        "T_C": 21,
        "lambda_nm": 1064,
        "n": 2.2321,
        "source": "computed",
        "tolerance": 6e-05
      },
      {
        "T_C": 21,
        "lambda_nm": 1550,
        "n": 2.2111,
        "source": "computed",
        "tolerance": 6e-05
      },
      {
        "T_C": 24.5,
        "lambda_nm": 632.8,
        "n": 2.2866,
        "source": "Nelson & Mikulyak 1974 via weis1985 Table 2; independent measurement",
        "tolerance": 0.0005
      },
      {
        "T_C": 24.5,
        "lambda_nm": 1060,
        "n": 2.2323,
        "source": "Nelson & Mikulyak 1974 via weis1985 Table 2; independent measurement",
        "tolerance": 0.0006
      }
    ],
    "coefficient_units": {
      "B1": "1",
      "B2": "1",
      "B3": "1",
      "C1": "um2",
      "C2": "um2",
      "C3": "um2"
    },
    "coefficients": {
      "B1": 2.6734,
      "B2": 1.229,
      "B3": 12.614,
      "C1": 0.01764,
      "C2": 0.05914,
      "C3": 474.6
    },
    "default": true,
    "errata": [],
    "formula": {
      "expression": "n^2 - 1 = B1 L^2/(L^2 - C1) + B2 L^2/(L^2 - C2) + B3 L^2/(L^2 - C3), L in um",
      "form": "sellmeier-3term",
      "latex": "n^2 - 1 = \\sum_{i=1}^{3} \\frac{B_i \\lambda^2}{\\lambda^2 - C_i}",
      "rii_formula": 2
    },
    "id": "zelmon1997-cln-o",
    "lambda_unit": "um",
    "name": "Zelmon 1997, congruent LiNbO3, ordinary",
    "provenance": {
      "locator": "Table 2 (via refractiveindex.info LiNbO3 Zelmon-o)",
      "source_id": "zelmon1997",
      "status": "P-db",
      "transcribed": "2026-10-25",
      "via": "rii"
    },
    "public": true,